{
  "$schema": "./methods-registry.schema.json",
  "_meta": {
    "description": "Python Worker 메서드 레지스트리 - Single Source of Truth",
    "version": "1.0.0",
    "updated": "2025-12-17",
    "purpose": "TypeScript-Python 간 계약(Contract) 정의"
  },
  "worker1": {
    "name": "descriptive",
    "description": "기술통계 및 기본 검정",
    "packages": ["numpy", "scipy"],
    "methods": {
      "descriptive_stats": {
        "params": ["data", "confidenceLevel?"],
        "returns": ["mean", "median", "mode", "std", "variance", "min", "max", "q1", "q3", "iqr", "skewness", "kurtosis", "n"],
        "description": "기술통계량 계산"
      },
      "normality_test": {
        "params": ["data", "alpha?"],
        "returns": ["statistic", "pValue", "isNormal", "interpretation"],
        "description": "Shapiro-Wilk 정규성 검정"
      },
      "outlier_detection": {
        "params": ["data", "method?"],
        "returns": ["outlierIndices", "outlierValues", "lowerBound", "upperBound", "method"],
        "description": "이상치 탐지 (IQR/Z-score)"
      },
      "frequency_analysis": {
        "params": ["values"],
        "returns": ["categories", "frequencies", "percentages", "cumulativePercentages", "total", "uniqueCount"],
        "description": "빈도분석"
      },
      "crosstab_analysis": {
        "params": ["rowValues", "colValues"],
        "returns": ["rowCategories", "colCategories", "observedMatrix", "rowTotals", "colTotals", "grandTotal"],
        "description": "교차분석"
      },
      "one_sample_proportion_test": {
        "params": ["successCount", "totalCount", "nullProportion?", "alternative?", "alpha?"],
        "returns": ["sampleProportion", "nullProportion", "pValue", "zStatistic", "pValueExact", "pValueApprox", "significant", "alpha"],
        "description": "일표본 비율검정"
      },
      "cronbach_alpha": {
        "params": ["itemsMatrix"],
        "returns": ["alpha", "nItems", "nRespondents"],
        "description": "크론바흐 알파 신뢰도"
      },
      "kolmogorov_smirnov_test": {
        "params": ["data"],
        "returns": ["statistic", "pValue", "isNormal"],
        "description": "K-S 정규성 검정"
      },
      "ks_test_one_sample": {
        "params": ["values"],
        "returns": ["statistic", "pValue", "n", "significant", "interpretation"],
        "description": "일표본 K-S 검정"
      },
      "ks_test_two_sample": {
        "params": ["values1", "values2"],
        "returns": ["statistic", "pValue", "n1", "n2", "significant"],
        "description": "이표본 K-S 검정"
      },
      "mann_kendall_test": {
        "params": ["data"],
        "returns": ["trend", "statistic", "pValue", "tau", "slope", "intercept"],
        "description": "Mann-Kendall 추세 검정"
      },
      "bonferroni_correction": {
        "params": ["pValues", "alpha?"],
        "returns": ["adjustedPValues", "significantResults", "alpha", "correctedAlpha"],
        "description": "Bonferroni 다중비교 보정"
      },
      "means_plot_data": {
        "params": ["data", "dependentVar", "factorVar"],
        "returns": ["descriptives", "plotData", "interpretation"],
        "description": "평균 플롯 데이터"
      }
    }
  },
  "worker2": {
    "name": "hypothesis",
    "description": "가설검정 및 상관분석",
    "packages": ["numpy", "scipy", "statsmodels", "pandas"],
    "methods": {
      "t_test_two_sample": {
        "params": ["group1", "group2", "equalVar?"],
        "returns": ["statistic", "pValue", "cohensD", "mean1", "mean2", "std1", "std2", "n1", "n2"],
        "description": "독립표본 t-검정"
      },
      "t_test_paired": {
        "params": ["values1", "values2"],
        "returns": ["statistic", "pValue", "meanDiff", "nPairs"],
        "description": "대응표본 t-검정"
      },
      "t_test_one_sample": {
        "params": ["data", "popmean?"],
        "returns": ["statistic", "pValue", "sampleMean", "sampleStd", "n"],
        "description": "일표본 t-검정"
      },
      "z_test": {
        "params": ["data", "popmean", "popstd"],
        "returns": ["statistic", "pValue", "sampleMean", "n"],
        "description": "Z-검정"
      },
      "chi_square_test": {
        "params": ["observedMatrix", "yatesCorrection?"],
        "returns": ["statistic", "pValue", "df", "expectedMatrix"],
        "description": "카이제곱 검정"
      },
      "binomial_test": {
        "params": ["successCount", "totalCount", "probability?", "alternative?"],
        "returns": ["pValue", "successCount", "totalCount", "proportion", "expectedProportion"],
        "description": "이항검정"
      },
      "correlation_test": {
        "params": ["x", "y", "method?"],
        "returns": ["correlation", "pValue", "n"],
        "description": "상관계수 검정"
      },
      "partial_correlation": {
        "params": ["dataMatrix", "xIdx", "yIdx", "controlIndices"],
        "returns": ["correlation", "pValue", "df", "confidenceInterval"],
        "description": "편상관분석"
      },
      "levene_test": {
        "params": ["groups"],
        "returns": ["statistic", "pValue", "equalVariance"],
        "description": "Levene 등분산 검정"
      },
      "bartlett_test": {
        "params": ["groups"],
        "returns": ["statistic", "pValue", "equalVariance"],
        "description": "Bartlett 등분산 검정"
      },
      "chi_square_goodness_test": {
        "params": ["observed", "expected?", "alpha?"],
        "returns": ["chiSquare", "pValue", "degreesOfFreedom", "criticalValue", "reject", "observed", "expected"],
        "description": "카이제곱 적합도 검정"
      },
      "chi_square_independence_test": {
        "params": ["observedMatrix", "yatesCorrection?", "alpha?"],
        "returns": ["chiSquare", "pValue", "df", "criticalValue", "reject", "cramersV", "observedMatrix", "expectedMatrix"],
        "description": "카이제곱 독립성 검정"
      },
      "fisher_exact_test": {
        "params": ["table", "alternative?", "alpha?"],
        "returns": ["pValue", "oddsRatio"],
        "description": "Fisher 정확검정"
      },
      "power_analysis": {
        "params": ["testType", "analysisType", "alpha?", "power?", "effectSize?", "sampleSize?", "sides?"],
        "returns": ["requiredSampleSize", "achievedPower", "effectSize", "alpha", "interpretation"],
        "description": "검정력 분석"
      }
    }
  },
  "worker3": {
    "name": "nonparametric-anova",
    "description": "비모수 검정 및 분산분석",
    "packages": ["numpy", "scipy", "statsmodels", "pandas", "scikit-learn"],
    "methods": {
      "mann_whitney_test": {
        "params": ["group1", "group2"],
        "returns": ["statistic", "pValue", "effectSize"],
        "description": "Mann-Whitney U 검정"
      },
      "wilcoxon_test": {
        "params": ["values1", "values2"],
        "returns": ["statistic", "pValue", "effectSize"],
        "description": "Wilcoxon 부호순위 검정"
      },
      "kruskal_wallis_test": {
        "params": ["groups"],
        "returns": ["statistic", "pValue", "df"],
        "description": "Kruskal-Wallis H 검정"
      },
      "friedman_test": {
        "params": ["groups"],
        "returns": ["statistic", "pValue", "df"],
        "description": "Friedman 검정"
      },
      "one_way_anova": {
        "params": ["groups"],
        "returns": ["fStatistic", "pValue", "dfBetween", "dfWithin", "etaSquared", "omegaSquared"],
        "description": "일원 분산분석"
      },
      "two_way_anova": {
        "params": ["dataValues", "factor1Values", "factor2Values"],
        "returns": ["factor1", "factor2", "interaction", "residual", "anovaTable"],
        "description": "이원 분산분석"
      },
      "tukey_hsd": {
        "params": ["groups"],
        "returns": ["comparisons"],
        "description": "Tukey HSD 사후검정"
      },
      "sign_test": {
        "params": ["before", "after"],
        "returns": ["statistic", "pValue", "nPositive", "nNegative", "nTies"],
        "description": "부호 검정"
      },
      "runs_test": {
        "params": ["sequence"],
        "returns": ["statistic", "pValue", "nRuns", "expectedRuns"],
        "description": "런 검정"
      },
      "mcnemar_test": {
        "params": ["contingencyTable"],
        "returns": ["statistic", "pValue", "continuityCorrection", "discordantPairs"],
        "description": "McNemar 검정"
      },
      "cochran_q_test": {
        "params": ["dataMatrix"],
        "returns": ["qStatistic", "pValue", "df"],
        "description": "Cochran Q 검정"
      },
      "mood_median_test": {
        "params": ["groups"],
        "returns": ["statistic", "pValue", "grandMedian"],
        "description": "Mood 중앙값 검정"
      },
      "repeated_measures_anova": {
        "params": ["dataMatrix", "subjectIds", "timeLabels"],
        "returns": ["fStatistic", "pValue", "df"],
        "description": "반복측정 분산분석"
      },
      "ancova": {
        "params": ["yValues", "groupValues", "covariates"],
        "returns": ["fStatistic", "pValue", "adjustedMeans"],
        "description": "공분산분석"
      },
      "manova": {
        "params": ["dataMatrix", "groupValues", "varNames"],
        "returns": ["wilksLambda", "fStatistic", "pValue"],
        "description": "다변량 분산분석"
      },
      "scheffe_test": {
        "params": ["groups"],
        "returns": ["comparisons"],
        "description": "Scheffe 사후검정"
      },
      "dunn_test": {
        "params": ["groups", "pAdjust?"],
        "returns": ["comparisons"],
        "description": "Dunn 사후검정"
      },
      "games_howell_test": {
        "params": ["groups"],
        "returns": ["comparisons"],
        "description": "Games-Howell 사후검정"
      }
    }
  },
  "worker4": {
    "name": "regression-advanced",
    "description": "회귀분석 및 고급 통계",
    "packages": ["numpy", "scipy", "statsmodels", "scikit-learn"],
    "methods": {
      "linear_regression": {
        "params": ["x", "y"],
        "returns": ["slope", "intercept", "rSquared", "adjRSquared", "pValue", "standardError"],
        "description": "단순 선형회귀"
      },
      "multiple_regression": {
        "params": ["X", "y"],
        "returns": ["coefficients", "rSquared", "adjRSquared", "fStatistic", "pValue"],
        "description": "다중 회귀분석"
      },
      "logistic_regression": {